{"artifact_id":"mechanism.constraint","artifact_kind":"mechanism_figure","inputs":[{"artifact_id":"source.mechanisms","binding_id":"binding.mechanism","json_pointer":"/tasks/2/facts","ledger_event_id":"evt-00000000-0000-4000-8000-000000000002","ledger_event_sha256":"82c5ee42eeb289abe8abff1014b3f320479a7af8e6013a91a2ad745c479ad8df","sha256":"1da80549db36ee87502bbdcfc92f1f45352942b7152fd97cdc6657d1a3016683"}],"ir_sha256":"6036aa2bd0ddc24b5481eff0143d69e46ff1df65504c3700b49383f3fe819f7d","min_font_pt":8.0,"outputs":[{"path":".arw/artifacts/accepted/mechanism.constraint/ir.json","sha256":"6036aa2bd0ddc24b5481eff0143d69e46ff1df65504c3700b49383f3fe819f7d"},{"path":".arw/artifacts/accepted/mechanism.constraint/figure.svg","sha256":"442a29a9952c66c18c28082d203e4d861796f7cd637c1e148dd5f2da4a9b6090"}],"purpose":"exploratory","qualification":"PASS","reason_codes":[],"receipt_version":"arw.mechanism-figure-receipt.v1","renderer":{"identity_digest":"0ab7e06fc46058447dfeca40e82f42780823b42f56ddbf60a928d6c3b377430f","name":"arw.mechanism-svg","normalization_policy":"utf8-svg-explicit-ports-pt.v1","version":"1.0.0"},"revision":1,"validation":{"provenance":"PASS","render":"PASS","schema":"PASS","semantic":"PASS","visual":"OPTIONAL_SKIPPED"},"validation_policy":{"provenance":"REQUIRED","render":"REQUIRED","schema":"REQUIRED","semantic":"REQUIRED","visual":"OPTIONAL"},"visual_reviewer":null}
