{"artifact_id":"mechanism.constraint.publication","artifact_kind":"mechanism_figure","inputs":[{"artifact_id":"source.mechanisms","binding_id":"binding.mechanism","json_pointer":"/tasks/2/facts","ledger_event_id":"evt-00000000-0000-4000-8000-000000000002","ledger_event_sha256":"615ffc4e5b8b9bd8a8cbf08956ccef109ea1f6316e7ab401f4bba2b92c31c2a8","sha256":"cb687ca76f22b2b9414d25c263b29ee189301202f15fa0485a5df6a0ffc84bd6"}],"ir_sha256":"8b354ae69c3cf9d9658cca132554cc9b369e47f4c3c54fd8b5c6039b934c0504","min_font_pt":8.0,"outputs":[{"path":".arw/artifacts/candidates/mechanism.constraint.publication/8b354ae69c3cf9d9658cca132554cc9b369e47f4c3c54fd8b5c6039b934c0504/ir.json","sha256":"8b354ae69c3cf9d9658cca132554cc9b369e47f4c3c54fd8b5c6039b934c0504"},{"path":".arw/artifacts/candidates/mechanism.constraint.publication/8b354ae69c3cf9d9658cca132554cc9b369e47f4c3c54fd8b5c6039b934c0504/figure.svg","sha256":"1ccd3d04363c507fddfa62b3e8691bfe42bff35d2acae916b1a6b8d7d75945e6"}],"purpose":"publication-critical","qualification":"FAIL","reason_codes":[],"receipt_version":"arw.mechanism-figure-receipt.v1","renderer":{"identity_digest":"8f55510ef21883be9d34d2e31230ed95cfa5dee14da889d3be708e9547a4a3ae","name":"arw.mechanism-svg","normalization_policy":"utf8-svg-explicit-ports-pt.v1","version":"1.0.0"},"revision":1,"validation":{"provenance":"PASS","render":"PASS","schema":"PASS","semantic":"PASS","visual":"UNAVAILABLE"},"validation_policy":{"provenance":"REQUIRED","render":"REQUIRED","schema":"REQUIRED","semantic":"REQUIRED","visual":"REQUIRED"},"visual_reviewer":null}
