{"artifact_id":"mechanism.tool-loop.publication","artifact_kind":"mechanism_figure","inputs":[{"artifact_id":"source.mechanisms","binding_id":"binding.mechanism","json_pointer":"/tasks/1/facts","ledger_event_id":"evt-00000000-0000-4000-8000-000000000002","ledger_event_sha256":"1686f074f3440e286238a0a43422b531ed76478b97b6660fb4794911eb8fd372","sha256":"2966ef13f498cbf022ca989b5e87aa44f9e0adce458a164d20c7ae115742d171"}],"ir_sha256":"02e7be6ad866393881afb19bb98e7ac079ac5f84fe08c86995b1dd9f41128fc7","min_font_pt":8.0,"outputs":[{"path":".arw/artifacts/candidates/mechanism.tool-loop.publication/02e7be6ad866393881afb19bb98e7ac079ac5f84fe08c86995b1dd9f41128fc7/ir.json","sha256":"02e7be6ad866393881afb19bb98e7ac079ac5f84fe08c86995b1dd9f41128fc7"},{"path":".arw/artifacts/candidates/mechanism.tool-loop.publication/02e7be6ad866393881afb19bb98e7ac079ac5f84fe08c86995b1dd9f41128fc7/figure.svg","sha256":"17094990f99118d0055447487a2488fdb7587c3c48bdd0d5ed2f120332ca9e5a"}],"purpose":"publication-critical","qualification":"FAIL","reason_codes":[],"receipt_version":"arw.mechanism-figure-receipt.v1","renderer":{"identity_digest":"6587ed37ca5cde5326524a261e203e17ed39bfbbd06669524e109a958af4576f","name":"arw.mechanism-svg","normalization_policy":"utf8-svg-explicit-ports-pt.v1","version":"1.1.0"},"revision":1,"validation":{"provenance":"PASS","render":"PASS","schema":"PASS","semantic":"PASS","visual":"UNAVAILABLE"},"validation_policy":{"provenance":"REQUIRED","render":"REQUIRED","schema":"REQUIRED","semantic":"REQUIRED","visual":"REQUIRED"},"visual_reviewer":null}
