{"artifact_id":"mechanism.representation","artifact_kind":"mechanism_figure","inputs":[{"artifact_id":"source.mechanisms","binding_id":"binding.mechanism","json_pointer":"/tasks/0/facts","ledger_event_id":"evt-00000000-0000-4000-8000-000000000002","ledger_event_sha256":"615ffc4e5b8b9bd8a8cbf08956ccef109ea1f6316e7ab401f4bba2b92c31c2a8","sha256":"cb687ca76f22b2b9414d25c263b29ee189301202f15fa0485a5df6a0ffc84bd6"}],"ir_sha256":"6b1b5b6d67d8134d6a51b9a383b99b92e13471c8c4c65dd3a82c8c2d7b6ac70d","min_font_pt":8.0,"outputs":[{"path":".arw/artifacts/accepted/mechanism.representation/ir.json","sha256":"6b1b5b6d67d8134d6a51b9a383b99b92e13471c8c4c65dd3a82c8c2d7b6ac70d"},{"path":".arw/artifacts/accepted/mechanism.representation/figure.svg","sha256":"eb82ab790477d98f6e841fde9669d06c4dcd9e9b5ac532523f2f885b72820f89"}],"purpose":"exploratory","qualification":"PASS","reason_codes":[],"receipt_version":"arw.mechanism-figure-receipt.v1","renderer":{"identity_digest":"8f55510ef21883be9d34d2e31230ed95cfa5dee14da889d3be708e9547a4a3ae","name":"arw.mechanism-svg","normalization_policy":"utf8-svg-explicit-ports-pt.v1","version":"1.0.0"},"revision":1,"validation":{"provenance":"PASS","render":"PASS","schema":"PASS","semantic":"PASS","visual":"OPTIONAL_SKIPPED"},"validation_policy":{"provenance":"REQUIRED","render":"REQUIRED","schema":"REQUIRED","semantic":"REQUIRED","visual":"OPTIONAL"},"visual_reviewer":null}
