{"artifact_id":"mechanism.constraint","artifact_kind":"mechanism_figure","inputs":[{"artifact_id":"source.mechanisms","binding_id":"binding.mechanism","json_pointer":"/tasks/2/facts","ledger_event_id":"evt-00000000-0000-4000-8000-000000000002","ledger_event_sha256":"1686f074f3440e286238a0a43422b531ed76478b97b6660fb4794911eb8fd372","sha256":"2966ef13f498cbf022ca989b5e87aa44f9e0adce458a164d20c7ae115742d171"}],"ir_sha256":"bc6f94b70f36e4fc6d9b8d013f43f4dc4e722cbb1f67fbefd36f1ad5f5a7b1b9","min_font_pt":8.0,"outputs":[{"path":".arw/artifacts/accepted/mechanism.constraint/ir.json","sha256":"bc6f94b70f36e4fc6d9b8d013f43f4dc4e722cbb1f67fbefd36f1ad5f5a7b1b9"},{"path":".arw/artifacts/accepted/mechanism.constraint/figure.svg","sha256":"9c9287447564fb1969d727772e15314fb5bb91b226716b8114b9934453c97c8d"}],"purpose":"exploratory","qualification":"PASS","reason_codes":[],"receipt_version":"arw.mechanism-figure-receipt.v1","renderer":{"identity_digest":"6587ed37ca5cde5326524a261e203e17ed39bfbbd06669524e109a958af4576f","name":"arw.mechanism-svg","normalization_policy":"utf8-svg-explicit-ports-pt.v1","version":"1.1.0"},"revision":1,"validation":{"provenance":"PASS","render":"PASS","schema":"PASS","semantic":"PASS","visual":"OPTIONAL_SKIPPED"},"validation_policy":{"provenance":"REQUIRED","render":"REQUIRED","schema":"REQUIRED","semantic":"REQUIRED","visual":"OPTIONAL"},"visual_reviewer":null}
