{"artifact_id":"mechanism.representation","artifact_kind":"mechanism_figure","inputs":[{"artifact_id":"source.mechanisms","binding_id":"binding.mechanism","json_pointer":"/tasks/0/facts","ledger_event_id":"evt-00000000-0000-4000-8000-000000000002","ledger_event_sha256":"82c5ee42eeb289abe8abff1014b3f320479a7af8e6013a91a2ad745c479ad8df","sha256":"1da80549db36ee87502bbdcfc92f1f45352942b7152fd97cdc6657d1a3016683"}],"ir_sha256":"b455921e2eee7f5420d9a7a484ba815a0ccbf5180522cfcc0f5dbeee93fabe97","min_font_pt":8.0,"outputs":[{"path":".arw/artifacts/accepted/mechanism.representation/ir.json","sha256":"b455921e2eee7f5420d9a7a484ba815a0ccbf5180522cfcc0f5dbeee93fabe97"},{"path":".arw/artifacts/accepted/mechanism.representation/figure.svg","sha256":"4aef7f546b6120c5d07e59e10d0dea2457d295f4ae6c8211df358af4365e8ae1"}],"purpose":"exploratory","qualification":"PASS","reason_codes":[],"receipt_version":"arw.mechanism-figure-receipt.v1","renderer":{"identity_digest":"0ab7e06fc46058447dfeca40e82f42780823b42f56ddbf60a928d6c3b377430f","name":"arw.mechanism-svg","normalization_policy":"utf8-svg-explicit-ports-pt.v1","version":"1.0.0"},"revision":1,"validation":{"provenance":"PASS","render":"PASS","schema":"PASS","semantic":"PASS","visual":"OPTIONAL_SKIPPED"},"validation_policy":{"provenance":"REQUIRED","render":"REQUIRED","schema":"REQUIRED","semantic":"REQUIRED","visual":"OPTIONAL"},"visual_reviewer":null}
