{"artifact_id":"mechanism.representation.publication","artifact_kind":"mechanism_figure","inputs":[{"artifact_id":"source.mechanisms","binding_id":"binding.mechanism","json_pointer":"/tasks/0/facts","ledger_event_id":"evt-00000000-0000-4000-8000-000000000002","ledger_event_sha256":"82c5ee42eeb289abe8abff1014b3f320479a7af8e6013a91a2ad745c479ad8df","sha256":"1da80549db36ee87502bbdcfc92f1f45352942b7152fd97cdc6657d1a3016683"}],"ir_sha256":"e7867eda3c92b3c9deaff8a26dfd492a24bb58ef89eb4a9d01e8e541aac0e4a9","min_font_pt":8.0,"outputs":[{"path":".arw/artifacts/candidates/mechanism.representation.publication/e7867eda3c92b3c9deaff8a26dfd492a24bb58ef89eb4a9d01e8e541aac0e4a9/ir.json","sha256":"e7867eda3c92b3c9deaff8a26dfd492a24bb58ef89eb4a9d01e8e541aac0e4a9"},{"path":".arw/artifacts/candidates/mechanism.representation.publication/e7867eda3c92b3c9deaff8a26dfd492a24bb58ef89eb4a9d01e8e541aac0e4a9/figure.svg","sha256":"4aef7f546b6120c5d07e59e10d0dea2457d295f4ae6c8211df358af4365e8ae1"}],"purpose":"publication-critical","qualification":"FAIL","reason_codes":[],"receipt_version":"arw.mechanism-figure-receipt.v1","renderer":{"identity_digest":"0ab7e06fc46058447dfeca40e82f42780823b42f56ddbf60a928d6c3b377430f","name":"arw.mechanism-svg","normalization_policy":"utf8-svg-explicit-ports-pt.v1","version":"1.0.0"},"revision":1,"validation":{"provenance":"PASS","render":"PASS","schema":"PASS","semantic":"PASS","visual":"UNAVAILABLE"},"validation_policy":{"provenance":"REQUIRED","render":"REQUIRED","schema":"REQUIRED","semantic":"REQUIRED","visual":"REQUIRED"},"visual_reviewer":null}
