{"artifact_id":"mechanism.tool-loop.publication","artifact_kind":"mechanism_figure","inputs":[{"artifact_id":"source.mechanisms","binding_id":"binding.mechanism","json_pointer":"/tasks/1/facts","ledger_event_id":"evt-00000000-0000-4000-8000-000000000002","ledger_event_sha256":"615ffc4e5b8b9bd8a8cbf08956ccef109ea1f6316e7ab401f4bba2b92c31c2a8","sha256":"cb687ca76f22b2b9414d25c263b29ee189301202f15fa0485a5df6a0ffc84bd6"}],"ir_sha256":"cd21444219275ca394f9c046874cf2d8b6942c0bedb238156316acc9e8a11224","min_font_pt":8.0,"outputs":[{"path":".arw/artifacts/candidates/mechanism.tool-loop.publication/cd21444219275ca394f9c046874cf2d8b6942c0bedb238156316acc9e8a11224/ir.json","sha256":"cd21444219275ca394f9c046874cf2d8b6942c0bedb238156316acc9e8a11224"},{"path":".arw/artifacts/candidates/mechanism.tool-loop.publication/cd21444219275ca394f9c046874cf2d8b6942c0bedb238156316acc9e8a11224/figure.svg","sha256":"cc65bc885d54a41ceac636842d7dd5ea3a6c1647d0c5898bd848d79b4caeba5c"}],"purpose":"publication-critical","qualification":"FAIL","reason_codes":[],"receipt_version":"arw.mechanism-figure-receipt.v1","renderer":{"identity_digest":"8f55510ef21883be9d34d2e31230ed95cfa5dee14da889d3be708e9547a4a3ae","name":"arw.mechanism-svg","normalization_policy":"utf8-svg-explicit-ports-pt.v1","version":"1.0.0"},"revision":1,"validation":{"provenance":"PASS","render":"PASS","schema":"PASS","semantic":"PASS","visual":"UNAVAILABLE"},"validation_policy":{"provenance":"REQUIRED","render":"REQUIRED","schema":"REQUIRED","semantic":"REQUIRED","visual":"REQUIRED"},"visual_reviewer":null}
